{
  "centrality_score": 0.9975460122699387,
  "classification": "INTERNAL",
  "confidence": "EXTRACTED",
  "content": {
    "kind": "method",
    "language": "java",
    "summary": "java method: process",
    "symbol": "process"
  },
  "created": "2026-04-19T17:26:31Z",
  "created_by": "cartographer",
  "id": "pat-0737a71e96e5",
  "landmark": true,
  "lifecycle": "permanent",
  "promotion_state": "draft",
  "provenance": {
    "trigger_event": "bootstrap.scan"
  },
  "scope": "project",
  "tags": [
    "java",
    "method",
    "ast",
    "bootstrap",
    "pkg-testdata"
  ],
  "type": "pattern",
  "updated": "2026-04-19T17:26:31Z",
  "updated_by": "cartographer"
}
