{
  "centrality_score": 0.9975460122699387,
  "classification": "INTERNAL",
  "confidence": "EXTRACTED",
  "content": {
    "doc": "TestValidate_ValidConfidenceValues accepts all three valid confidence values.",
    "kind": "function",
    "language": "go",
    "name": "TestValidate_ValidConfidenceValues",
    "summary": "Function: TestValidate_ValidConfidenceValues — TestValidate_ValidConfidenceValues accepts all three valid confidence values."
  },
  "created": "2026-04-19T17:26:31Z",
  "created_by": "cartographer",
  "id": "pat-8ab7c0c4ab61",
  "landmark": false,
  "lifecycle": "permanent",
  "promotion_state": "draft",
  "provenance": {
    "trigger_event": "bootstrap.scan"
  },
  "scope": "project",
  "tags": [
    "go",
    "function",
    "ast",
    "bootstrap",
    "pkg-kb",
    "test"
  ],
  "type": "pattern",
  "updated": "2026-04-19T17:26:31Z",
  "updated_by": "cartographer"
}
