{
  "centrality_score": 0.9975460122699387,
  "classification": "INTERNAL",
  "confidence": "INFERRED",
  "content": {
    "body": "Extends both .leo/schema.json and cli/internal/cmd/schema.json with eight\nnew optional top-level fields for memory schema evolution (#68). All fields\nare excluded from `required`, preserving full backward compatibility with\nexisting legacy memory files.\n\nCo-Authored-By: Claude Opus 4.7 (1M context) \u003cnoreply@anthropic.com\u003e",
    "commit_sha": "22f9540bd376ade7a923437142ae19a659f7468e",
    "prefix": "feat",
    "scope": "schema",
    "subject": "feat(schema): add provenance, confidence, classification, compartments, landmark, centrality_score fields",
    "summary": "add provenance, confidence, classification, compartments, landmark, centrality_score fields. Extends both .leo/schema.json and cli/internal/cmd/schema.json with eight\nnew optional top-level fields ..."
  },
  "created": "2026-04-19T17:26:31Z",
  "created_by": "cartographer",
  "id": "dec-10e8cdb64616",
  "landmark": false,
  "lifecycle": "permanent",
  "promotion_state": "draft",
  "provenance": {
    "commit_sha": "22f9540bd376ade7a923437142ae19a659f7468e",
    "trigger_event": "bootstrap.scan"
  },
  "scope": "project",
  "tags": [
    "commit",
    "bootstrap",
    "feat",
    "schema"
  ],
  "type": "decision",
  "updated": "2026-04-19T17:26:31Z",
  "updated_by": "cartographer"
}
