{
  "centrality_score": 0.9975460122699387,
  "classification": "INTERNAL",
  "confidence": "EXTRACTED",
  "content": {
    "doc": "toolDef describes one MCP tool for the tools/list response.",
    "kind": "type",
    "language": "go",
    "name": "toolDef",
    "summary": "Type: toolDef — toolDef describes one MCP tool for the tools/list response."
  },
  "created": "2026-04-19T17:26:31Z",
  "created_by": "cartographer",
  "id": "pat-010c4582e961",
  "landmark": false,
  "lifecycle": "permanent",
  "promotion_state": "draft",
  "provenance": {
    "trigger_event": "bootstrap.scan"
  },
  "scope": "project",
  "tags": [
    "go",
    "type",
    "ast",
    "bootstrap",
    "pkg-mcp"
  ],
  "type": "pattern",
  "updated": "2026-04-19T17:26:31Z",
  "updated_by": "cartographer"
}
