{
  "centrality_score": 0.9975460122699387,
  "classification": "INTERNAL",
  "confidence": "INFERRED",
  "content": {
    "body": "promote \u003cid\u003e --to \u003cscope\u003e moves a memory doc from the nearest .leo/ up\nto the nearest ancestor with the target scope label. demote reverses it.\nBoth rewrite provenance tags (promoted_from / demoted_from) and error\nclearly when no matching ancestor exists.\n\nleo doctor now prints an \"Active scopes (nearest first)\" section showing\nscope label, .leo/ path, and memory count for each discovered scope.\n\nCo-Authored-By: Claude Opus 4.7 (1M context) \u003cnoreply@anthropic.com\u003e",
    "commit_sha": "b368fc613dcff5fe1c3c27171d7656f2fff8b893",
    "prefix": "feat",
    "scope": "",
    "subject": "feat: add leo promote/demote + doctor scopes section",
    "summary": "add leo promote/demote + doctor scopes section. promote \u003cid\u003e --to \u003cscope\u003e moves a memory doc from the nearest .leo/ up\nto the nearest ancestor with the target scope label. demote reverses it.\nBoth ..."
  },
  "created": "2026-04-19T17:26:31Z",
  "created_by": "cartographer",
  "id": "dec-926186530352",
  "landmark": false,
  "lifecycle": "permanent",
  "promotion_state": "draft",
  "provenance": {
    "commit_sha": "b368fc613dcff5fe1c3c27171d7656f2fff8b893",
    "trigger_event": "bootstrap.scan"
  },
  "scope": "project",
  "tags": [
    "commit",
    "bootstrap",
    "feat"
  ],
  "type": "decision",
  "updated": "2026-04-19T17:26:31Z",
  "updated_by": "cartographer"
}
