{
  "centrality_score": 0.9975460122699387,
  "classification": "INTERNAL",
  "confidence": "EXTRACTED",
  "content": {
    "kind": "method",
    "language": "go",
    "name": "Watermark",
    "receiver": "(a *ClaudeAdapter)",
    "summary": "Method: (a *ClaudeAdapter)Watermark"
  },
  "created": "2026-04-19T17:26:31Z",
  "created_by": "cartographer",
  "id": "pat-9ad9b55165dc",
  "landmark": false,
  "lifecycle": "permanent",
  "promotion_state": "draft",
  "provenance": {
    "trigger_event": "bootstrap.scan"
  },
  "scope": "project",
  "tags": [
    "go",
    "method",
    "ast",
    "bootstrap",
    "pkg-runtime",
    "receiver-claudeadapter"
  ],
  "type": "pattern",
  "updated": "2026-04-19T17:26:31Z",
  "updated_by": "cartographer"
}
