{
  "centrality_score": 0.9975460122699387,
  "classification": "INTERNAL",
  "confidence": "EXTRACTED",
  "content": {
    "language": "rust",
    "manifest": "Cargo.toml",
    "package": "clap",
    "summary": "Depends on clap 4.0",
    "version": "4.0"
  },
  "created": "2026-04-19T17:26:31Z",
  "created_by": "cartographer",
  "id": "fact-1ad9dea2d10c",
  "landmark": false,
  "lifecycle": "permanent",
  "promotion_state": "draft",
  "provenance": {
    "trigger_event": "bootstrap.scan"
  },
  "scope": "project",
  "tags": [
    "dependency",
    "rust",
    "bootstrap"
  ],
  "type": "fact",
  "updated": "2026-04-19T17:26:31Z",
  "updated_by": "cartographer"
}
