{
  "centrality_score": 0.9975460122699387,
  "classification": "INTERNAL",
  "confidence": "EXTRACTED",
  "content": {
    "language": "go",
    "manifest": "go.mod",
    "package": "github.com/spf13/cobra",
    "summary": "Depends on github.com/spf13/cobra v1.10.2",
    "version": "v1.10.2"
  },
  "created": "2026-04-19T17:26:31Z",
  "created_by": "cartographer",
  "id": "fact-b96ae25b0669",
  "landmark": false,
  "lifecycle": "permanent",
  "promotion_state": "draft",
  "provenance": {
    "trigger_event": "bootstrap.scan"
  },
  "scope": "project",
  "tags": [
    "dependency",
    "go",
    "bootstrap"
  ],
  "type": "fact",
  "updated": "2026-04-19T17:26:31Z",
  "updated_by": "cartographer"
}
