{
  "centrality_score": 0.9975460122699387,
  "classification": "INTERNAL",
  "confidence": "INFERRED",
  "content": {
    "body": "- leo init now runs an interactive wizard (runtime, language, profile,\n  autonomy, core source) — skip with -y or --runtime flag\n- leo update syncs core-scoped KB docs and schema from a leo-core clone\n  into the project's .leo/ directory (closes #26)\n- Updated 8 KB docs to reflect current architecture (Go CLI, Leo ↔\n  Specialists model, no Managers layer)\n- Converted hiring-loop, md-fallback, migration-progress to historical\n  decision docs\n- Removed legacy files: install.sh, .claude/context/\n- Updated README, CONTRIBUTING, CLAUDE.md, project-config.yml\n\nCo-Authored-By: Claude Opus 4.6 \u003cnoreply@anthropic.com\u003e",
    "commit_sha": "2fb11405da2c473236621ce038d893c994d0407b",
    "prefix": "feat",
    "scope": "cli",
    "subject": "feat(cli): add interactive onboarding, leo update, and repo-wide cleanup",
    "summary": "add interactive onboarding, leo update, and repo-wide cleanup. - leo init now runs an interactive wizard (runtime, language, profile,\n  autonomy, core source) — skip with -y or --runtime flag\n- leo..."
  },
  "created": "2026-04-19T17:26:31Z",
  "created_by": "cartographer",
  "id": "dec-fb221feb9e4a",
  "landmark": false,
  "lifecycle": "permanent",
  "promotion_state": "draft",
  "provenance": {
    "commit_sha": "2fb11405da2c473236621ce038d893c994d0407b",
    "trigger_event": "bootstrap.scan"
  },
  "scope": "project",
  "tags": [
    "commit",
    "bootstrap",
    "feat",
    "cli"
  ],
  "type": "decision",
  "updated": "2026-04-19T17:26:31Z",
  "updated_by": "cartographer"
}
