{
  "centrality_score": 0.9975460122699387,
  "classification": "INTERNAL",
  "confidence": "EXTRACTED",
  "content": {
    "doc": "Reset clears the in-memory manifest (used by --refresh).",
    "kind": "method",
    "language": "go",
    "name": "Reset",
    "receiver": "(c *Cache)",
    "summary": "Method: (c *Cache)Reset — Reset clears the in-memory manifest (used by --refresh)."
  },
  "created": "2026-04-19T17:26:31Z",
  "created_by": "cartographer",
  "id": "pat-1fa7820dce3c",
  "landmark": false,
  "lifecycle": "permanent",
  "promotion_state": "draft",
  "provenance": {
    "trigger_event": "bootstrap.scan"
  },
  "scope": "project",
  "tags": [
    "go",
    "method",
    "ast",
    "bootstrap",
    "pkg-cartographer",
    "receiver-cache"
  ],
  "type": "pattern",
  "updated": "2026-04-19T17:26:31Z",
  "updated_by": "cartographer"
}
