{
  "centrality_score": 0.9975460122699387,
  "classification": "INTERNAL",
  "confidence": "EXTRACTED",
  "content": {
    "kind": "function",
    "language": "go",
    "name": "TestInitCmd_FailsIfAlreadyExists",
    "summary": "Function: TestInitCmd_FailsIfAlreadyExists"
  },
  "created": "2026-04-19T16:44:23Z",
  "created_by": "cartographer",
  "id": "pat-ab0f0e5f489d",
  "landmark": false,
  "lifecycle": "permanent",
  "promotion_state": "draft",
  "provenance": {
    "trigger_event": "bootstrap.scan"
  },
  "scope": "project",
  "tags": [
    "function",
    "go",
    "ast",
    "bootstrap"
  ],
  "type": "pattern",
  "updated": "2026-04-19T16:44:23Z",
  "updated_by": "cartographer"
}
