{
  "centrality_score": 0.9975460122699387,
  "classification": "INTERNAL",
  "confidence": "INFERRED",
  "content": {
    "body": "Introduces cli/internal/scope with Walk/NearestWritable/FindByLabel,\nstopping at $HOME, skipping symlinks, and defaulting missing scope\nfield to \"repo\" for backward compatibility. Adds Scope string field\nto Config struct (yaml:\"scope,omitempty\").\n\nCo-Authored-By: Claude Opus 4.7 (1M context) \u003cnoreply@anthropic.com\u003e",
    "commit_sha": "a28e9edce3d2490b89d2ba105b9241c9c1f87f7a",
    "prefix": "feat",
    "scope": "",
    "subject": "feat: add scope package + Scope field in config",
    "summary": "add scope package + Scope field in config. Introduces cli/internal/scope with Walk/NearestWritable/FindByLabel,\nstopping at $HOME, skipping symlinks, and defaulting missing scope\nfield to \"repo\" fo..."
  },
  "created": "2026-04-19T17:26:31Z",
  "created_by": "cartographer",
  "id": "dec-30e05f4bedb7",
  "landmark": false,
  "lifecycle": "permanent",
  "promotion_state": "draft",
  "provenance": {
    "commit_sha": "a28e9edce3d2490b89d2ba105b9241c9c1f87f7a",
    "trigger_event": "bootstrap.scan"
  },
  "scope": "project",
  "tags": [
    "commit",
    "bootstrap",
    "feat"
  ],
  "type": "decision",
  "updated": "2026-04-19T17:26:31Z",
  "updated_by": "cartographer"
}
